{
  "$schema":"https://json-schema.org/draft/2020-12/schema",
  "$id":"https://kis.local/contracts/documentation/reference/v1/publication.schema.json",
  "title":"KIS Documentation Reference Standard Publication",
  "type":"object","additionalProperties":false,
  "required":["schema_version","layout_profile","title","subtitle","version","status","generator"],
  "properties":{
    "schema_version":{"const":1},
    "layout_profile":{"const":"mcp-spec"},
    "title":{"const":"Documentation Reference Standard"},
    "subtitle":{"type":"string","minLength":1},
    "version":{"type":"string","pattern":"^[0-9]+\\.[0-9]+\\.[0-9]+$"},
    "status":{"type":"string","minLength":1},
    "generator":{"type":"object","additionalProperties":false,"required":["name","version","algorithm"],"properties":{"name":{"const":"kis-mcp-doc"},"version":{"type":"string","pattern":"^[0-9]+\\.[0-9]+\\.[0-9]+$"},"algorithm":{"const":"documentation-reference-standard-v1"}}}
  }
}
